{
    "aud": "tas-storefront",
    "prep": {
        "continuePage": "https://storefront.com/apps/zwango",
        "patchSet": [
            {
                "op": "test",
                "path": "status.incarnation",
                "value": 23
            },
            {
                "op": "add",
                "path": "installs",
                "value": {
                    "app": "hrsoft-zwango"
                }
            }
        ]
    },
    "iat": "some time",
    "exp": "some time"
}